imagelink,productlink,price,maxretailprice,ProductName,stars,GlobalRatings,Category,Sub-category-1,Sub-category-2,Sub-category-3,Sub-category-4,reviewsLink,HighLights,Fragrance Classification,Ideal For,Quantity,Sales Package,5 star ratings,4 star ratings,3 star ratings,2 star ratings,1 star ratings,globalReviews,reviews,Country of Origin
https://rukminim1.flixcart.com/image/612/612/ke0a7ww0/perfume/c/t/z/120-women-perfume-30-ml-pack-of-4-eau-de-parfum-envy-women-original-imafusfyzghmshuw.jpeg?q=70,https://www.flipkart.com/envy-women-perfume-30-ml-pack-4-eau-de-parfum-120-ml/p/itm435c0fc888939?pid=PERFUPVGVAHBECTZ&lid=LSTPERFUPVGVAHBECTZYVVYRI&marketplace=FLIPKART&q=Perfumes&store=g9b%2F0yh%2Fjhz&srno=s_2_47&otracker=search&otracker1=search&fm=organic&iid=ebd06927-1bec-41b5-aa59-f7954869ccf3.PERFUPVGVAHBECTZ.SEARCH&ppt=None&ppn=None&ssid=5ybiuwyyf40000001680892679537&qH=912db86381b14a19,423,700,ENVY Women Perfume 30 ml(Pack of 4) Eau de Parfum  -  120 ml  (For Women),4.5,"1,222 ratings and 69 reviews",Beauty and Grooming,Fragrances,Perfume,Eau De Parfum,ENVY Eau De Parfum,https://www.flipkart.com/envy-women-perfume-30-ml-pack-4-eau-de-parfum-120-ml/product-reviews/itm435c0fc888939?pid=PERFUPVGVAHBECTZ&lid=LSTPERFUPVGVAHBECTZYVVYRI&marketplace=FLIPKART,"[""Quantity: 120 ml"",""Ideal For: Women"",""Fragrance Classification: Eau de Parfum"",""Fragrance Family: Floral"",""Fragrance Segment: Budget""]",Eau de Parfum,Women,120 ml,4,855,207,81,34,45,69 Reviews,"[{""title"":""Must buy!"",""summary"":""Very good .....nice smell""},{""title"":""Good"",""summary"":""Not good as expected""},{""title"":""Value-for-money"",""summary"":""Value for money 🥰 That smells is like wow, i just love that.""},{""title"":""Wonderful"",""summary"":""nice product""},{""title"":""Great product"",""summary"":""01/23 products ✨️""},{""title"":""Worth the money"",""summary"":""Nice product""},{""title"":""Awesome"",""summary"":""Osm""},{""title"":""Unsatisfactory"",""summary"":""Worst product fragrance like alcohol, bad""},{""title"":""Highly recommended"",""summary"":""always prefer""},{""title"":""Slightly disappointed"",""summary"":""It's ok but iam not satisfied""}]",India
https://rukminim1.flixcart.com/image/612/612/xif0q/perfume/j/o/s/100-yearn-eau-de-parfum-100-ml-aquatic-perfume-for-men-eau-de-original-imagh2qcvtkxyqny.jpeg?q=70,https://www.flipkart.com/ajmal-yearn-perfume-100-ml/p/itmc843c332a25be?pid=PERFVEESEQZZZSVN&lid=LSTPERFVEESEQZZZSVNF5PGDV&marketplace=FLIPKART&q=Perfumes&store=g9b%2F0yh%2Fjhz&srno=s_2_48&otracker=search&otracker1=search&fm=organic&iid=en_EFclpuUgR6xuQ0YYjISdFpDuOI5OCW7K91ABotki8sc3mT%2Bycstf53HGVLUQU2b4Qxx5eBaYhTsR9ewc4cP%2FgA%3D%3D&ppt=None&ppn=None&ssid=5ybiuwyyf40000001680892679537&qH=912db86381b14a19,675,1500,Ajmal Yearn Perfume  -  100 ml  (For Men),4.2,418 ratings and 40 reviews,Beauty and Grooming,Fragrances,Perfume,Ajmal Perfume,Not available,https://www.flipkart.com/ajmal-yearn-perfume-100-ml/product-reviews/itmc843c332a25be?pid=PERFVEESEQZZZSVN&lid=LSTPERFVEESEQZZZSVNF5PGDV&marketplace=FLIPKART,"[""Quantity: 100 ml"",""Ideal For: Men"",""Fragrance Classification: Perfume"",""Fragrance Family: Floral"",""Fragrance Segment: Budget""]",Perfume,Men,100 ml,"1 EDP, 2 Testers",239,78,57,17,27,40 Reviews,"[{""title"":""Utterly Disappointed"",""summary"":""I am not setisfied with your produst""},{""title"":""Horrible"",""summary"":""It's just a water I'm not getting any smell please don't waste your money on this and you can't return also""},{""title"":""Absolute rubbish!"",""summary"":""Although my previous experience with ajmal perfumes were good, i am highly disapointed with this purchase.The top note is only good. But wears away in a matter of minutes. Behaves at the most like a regular EDT...and not EDP""},{""title"":""Absolute rubbish!"",""summary"":""Absolutely rubbish perfume. .Ajmal should learn some perfume making Process from Titan..""},{""title"":""Fair"",""summary"":""Smell is good but not long lasting !!""},{""title"":""Awesome"",""summary"":""Good""},{""title"":""Awesome"",""summary"":""Love the fragrance ❤️""},{""title"":""Great product"",""summary"":""Super""},{""title"":""Useless product"",""summary"":""Waste of money""},{""title"":""Very poor"",""summary"":""Poor fragrance quality""}]",India
https://rukminim1.flixcart.com/image/612/612/xif0q/perfume/c/e/p/100-date-perfume-for-women-notes-of-pink-pepper-red-fruits-eau-original-imagmg7gt8dhcghq.jpeg?q=70,https://www.flipkart.com/bella-vita-organic-date-perfume-women-notes-pink-pepper-red-fruits-eau-de-parfum-100-ml/p/itmc3bbcb76439eb?pid=PERGK3EZWRX2FZ7N&lid=LSTPERGK3EZWRX2FZ7NIKCYVP&marketplace=FLIPKART&q=Perfumes&store=g9b%2F0yh%2Fjhz&srno=s_2_49&otracker=search&otracker1=search&fm=organic&iid=ebd06927-1bec-41b5-aa59-f7954869ccf3.PERGK3EZWRX2FZ7N.SEARCH&ppt=None&ppn=None&ssid=5ybiuwyyf40000001680892679537&qH=912db86381b14a19,549,999,"Bella vita organic Date Perfume for Women || Notes of Pink Pepper, Red Fruits - Eau De Parfum Eau de Parfum  -  100 ml  (For Women)",4.7,204 ratings and 90 reviews,Beauty and Grooming,Fragrances,Perfume,Eau De Parfum,Bella vita organic Eau De Parfum,https://www.flipkart.com/bella-vita-organic-date-perfume-women-notes-pink-pepper-red-fruits-eau-de-parfum-100-ml/product-reviews/itmc3bbcb76439eb?pid=PERGK3EZWRX2FZ7N&lid=LSTPERGK3EZWRX2FZ7NIKCYVP&marketplace=FLIPKART,"[""Quantity: 100 ml"",""Ideal For: Women"",""Fragrance Classification: Eau de Parfum"",""Fragrance Family: Oriental"",""Fragrance Segment: Budget""]",Eau de Parfum,Women,100 ml,Not available,163,29,3,3,6,90 Reviews,"[{""title"":""Awesome"",""summary"":""Great product by Bella Vita .......I really like it .....if I call one word to this product then I would like to say awesome 🙂""},{""title"":""Fabulous!"",""summary"":""Very long lasting sweet fragrance but still not heavy. Not only the user but passersby also will surely adore the fragrance. A perfect gift at an affordable price. I gave it to my wife she loved it and got complimented, so I am absolutely happy.""},{""title"":""Must buy!"",""summary"":""It has amazing scent it lasts for long time also it has amazing ingredients it is one of the best perfume i have ever seen.""},{""title"":""Perfect product!"",""summary"":""Sweet fragrance and perfect party perfume""},{""title"":""Wonderful"",""summary"":""Excellent product . I am fully satisfied.""},{""title"":""Just wow!"",""summary"":""I ordered this for my wife. The fragrance is good. It last long upto 8-10 hours. Few sprays can simply uplift the mood. Base note is mesmerising. Travel friendly , can be carried and used well.""},{""title"":""Must buy!"",""summary"":""As the name suggest this is a true luxury perfume. It's quite long lasting , and the fragrance is fruity and sweet must buy it""},{""title"":""Excellent"",""summary"":""I feel this perfume is so good""},{""title"":""Great product"",""summary"":""Really awsm fragrance and  long lasting. Excellent product.""},{""title"":""Brilliant"",""summary"":""Amazing smell""}]",Not available
https://rukminim1.flixcart.com/image/612/612/xif0q/perfume/d/2/l/15-eau-de-parfum-bloom-15ml-eau-de-parfum-renee-women-original-imaghf6etesgfx9a.jpeg?q=70,https://www.flipkart.com/renee-eau-de-parfum-bloom-15ml-15-ml/p/itm8eddba3551f30?pid=PERGGNX6CZHFRDGR&lid=LSTPERGGNX6CZHFRDGR0YHQZC&marketplace=FLIPKART&q=Perfumes&store=g9b%2F0yh%2Fjhz&srno=s_2_50&otracker=search&otracker1=search&fm=organic&iid=ebd06927-1bec-41b5-aa59-f7954869ccf3.PERGGNX6CZHFRDGR.SEARCH&ppt=None&ppn=None&ssid=5ybiuwyyf40000001680892679537&qH=912db86381b14a19,299,350,"Renee Eau De Parfum Bloom, 15ml Eau de Parfum  -  15 ml  (For Women)",4.2,"1,975 ratings and 136 reviews",Beauty and Grooming,Fragrances,Perfume,Eau De Parfum,Renee Eau De Parfum,https://www.flipkart.com/renee-eau-de-parfum-bloom-15ml-15-ml/product-reviews/itm8eddba3551f30?pid=PERGGNX6CZHFRDGR&lid=LSTPERGGNX6CZHFRDGR0YHQZC&marketplace=FLIPKART,"[""Quantity: 15 ml"",""Ideal For: Women"",""Fragrance Classification: Eau de Parfum"",""Fragrance Family: Floral"",""Fragrance Segment: Budget"",""Base Note: Base Notes- Vanilla, Cocoa, Tonka"",""Heart Note: Middle Notes- Tuberose, Sandalwood, Jasmine"",""Top Note: Top - Almond""]",Eau de Parfum,Women,15 ml,"1pc RENEE Eau De Parfum Bloom, 50ml","1,091",435,231,94,124,136 Reviews,"[{""title"":""Highly recommended"",""summary"":""Nice smell...I like it""},{""title"":""Simply awesome"",""summary"":""Nice smell 😍😍 I like it 👍👍""},{""title"":""Fabulous!"",""summary"":""Nice""},{""title"":""Wonderful"",""summary"":""Such a beautiful and gentle fragrance""},{""title"":""Perfect product!"",""summary"":""I am in love with the fragrance 🥰 it's very sweet calming mind blowing 🥰🥰""},{""title"":""Very Good"",""summary"":""Smells good. I liked it very much. Must buy""},{""title"":""Worst experience ever!"",""summary"":""Worst one..no smell....don't buy...stop cheating by showing false reviews.""},{""title"":""Fabulous!"",""summary"":""Nice fragrance...""},{""title"":""Fair"",""summary"":""Smell not long lasting.""},{""title"":""Horrible"",""summary"":""Not at all lasting fragrance.and the intensity of the smell is too very light.not recommended.""}]",India
https://rukminim1.flixcart.com/image/612/612/kn0n6a80/perfume/m/s/c/120-cobra-perfume-10ml-pack-of-12-eau-de-parfum-st-john-men-original-imagfs7vffaqaahg.jpeg?q=70,https://www.flipkart.com/st-john-cobra-perfume-10ml-pack-12-eau-de-parfum-120-ml/p/itm87d053b61c941?pid=PERGFS7W6GWDWEGA&lid=LSTPERGFS7W6GWDWEGATNCEJR&marketplace=FLIPKART&q=Perfumes&store=g9b%2F0yh%2Fjhz&srno=s_2_51&otracker=search&otracker1=search&fm=organic&iid=ebd06927-1bec-41b5-aa59-f7954869ccf3.PERGFS7W6GWDWEGA.SEARCH&ppt=None&ppn=None&ssid=5ybiuwyyf40000001680892679537&qH=912db86381b14a19,375,660,ST-JOHN Cobra perfume 10ml (Pack of 12) Eau de Parfum  -  120 ml  (For Men & Women),4.4,211 ratings and 30 reviews,Beauty and Grooming,Fragrances,Perfume,Eau De Parfum,ST-JOHN Eau De Parfum,https://www.flipkart.com/st-john-cobra-perfume-10ml-pack-12-eau-de-parfum-120-ml/product-reviews/itm87d053b61c941?pid=PERGFS7W6GWDWEGA&lid=LSTPERGFS7W6GWDWEGATNCEJR&marketplace=FLIPKART,"[""Quantity: 120 ml"",""Ideal For: Men & Women"",""Fragrance Classification: Eau de Parfum"",""Fragrance Family: Floral"",""Fragrance Segment: Budget""]",Eau de Parfum,Men & Women,120 ml,12 Cobra perfume,137,44,7,13,10,30 Reviews,"[{""title"":""Highly recommended"",""summary"":""Excellent perfume""},{""title"":""Brilliant"",""summary"":""Super""},{""title"":""Waste of money!"",""summary"":""Avarge purfume""},{""title"":""Awesome"",""summary"":""Very good 😊""},{""title"":""Really Nice"",""summary"":""Super""},{""title"":""Pretty good"",""summary"":""Good services and v good products.""},{""title"":""Value-for-money"",""summary"":""Very nice smell""},{""title"":""Nice product"",""summary"":""Excellent worth for the amount""},{""title"":""Classy product"",""summary"":""Good""},{""title"":""Terrific purchase"",""summary"":""Nice""}]",India
https://rukminim1.flixcart.com/image/612/612/kmjhw280/perfume/r/d/i/240-blanc-noir-combo-long-lasting-deodorant-spray-pack-of-2-original-imagff6qszhjgwhr.jpeg?q=70,https://www.flipkart.com/man-company-blanc-noir-combo-long-lasting-deodorant-spray-pack-2-perfume-240-ml/p/itm24dedc20c3882?pid=PERGFF6QATBUMACF&lid=LSTPERGFF6QATBUMACFINPXNG&marketplace=FLIPKART&q=Perfumes&store=g9b%2F0yh%2Fjhz&srno=s_2_52&otracker=search&otracker1=search&fm=organic&iid=en_EFclpuUgR6xuQ0YYjISdFpDuOI5OCW7K91ABotki8sd5PHTD4Os%2FqgvhVISaq%2BRV2ju7oHWVsqTtyoTsnuJ5pQ%3D%3D&ppt=None&ppn=None&ssid=5ybiuwyyf40000001680892679537&qH=912db86381b14a19,571,698,THE MAN COMPANY Blanc & Noir Combo Long Lasting Deodorant Spray - Pack of 2 Perfume  -  240 ml  (For Men),4.3,648 ratings and 54 reviews,Beauty and Grooming,Fragrances,Perfume,THE MAN COMPANY Perfume,Not available,https://www.flipkart.com/man-company-blanc-noir-combo-long-lasting-deodorant-spray-pack-2-perfume-240-ml/product-reviews/itm24dedc20c3882?pid=PERGFF6QATBUMACF&lid=LSTPERGFF6QATBUMACFINPXNG&marketplace=FLIPKART,"[""Quantity: 240 ml"",""Ideal For: Men"",""Fragrance Classification: Perfume"",""Fragrance Family: Woody"",""Fragrance Segment: Budget"",""Base Note: Blanc - Musk, Amberwood and Sandalwood, Noir - Sandalwood, Vetiver and Amber"",""Heart Note: Blanc -Lemon, Birch Leaves and Cardamom, Noir - Lemon, Bergamot and Rosemary"",""Top Note: Blanc - Lavender, Geranium and Juniper, Noir - Carnation, Cedarwood and Rose""]",Perfume,Men,240 ml,"Body Perfume Blanc (120ml), Body Perfume Noir (120ml)",391,129,65,33,30,54 Reviews,"[{""title"":""Awesome"",""summary"":""Very nice products.""},{""title"":""Worth the money"",""summary"":""I am very Happy with this product, Amazing smell""},{""title"":""Excellent"",""summary"":""Best product""},{""title"":""Wonderful"",""summary"":""Nice parfum 👍""},{""title"":""Classy product"",""summary"":""After long time I got something good smell..... loved it""},{""title"":""Expected a better product"",""summary"":""Poor fragrance""},{""title"":""Nice"",""summary"":""Good""},{""title"":""Best in the market!"",""summary"":""Awsm 🥰😘""},{""title"":""Perfect product!"",""summary"":""Mind-blowing perfume""},{""title"":""Mind-blowing purchase"",""summary"":""I am so happy""}]",India
https://rukminim1.flixcart.com/image/612/612/xif0q/perfume/o/f/l/100-cobra-black-current-50ml-pack-of-2-body-perfume-spray-gift-original-imaghvnupnskh764.jpeg?q=70,https://www.flipkart.com/st-john-cobra-black-current-50ml-pack-2-body-perfume-spray-gift-eau-de-parfum-100-ml/p/itmcf6a825c48f9b?pid=PERGHVNVNM6ZJNUG&lid=LSTPERGHVNVNM6ZJNUGM7OGJ0&marketplace=FLIPKART&q=Perfumes&store=g9b%2F0yh%2Fjhz&srno=s_2_53&otracker=search&otracker1=search&fm=organic&iid=ebd06927-1bec-41b5-aa59-f7954869ccf3.PERGHVNVNM6ZJNUG.SEARCH&ppt=None&ppn=None&ssid=5ybiuwyyf40000001680892679537&qH=912db86381b14a19,213,998,ST-JOHN Cobra Black Current 50ml Pack of 2 Body Perfume Spray Gift Pack Eau de Parfum  -  100 ml  (For Men & Women),4.6,5 ratings and 1 reviews,Beauty and Grooming,Fragrances,Perfume,Eau De Parfum,ST-JOHN Eau De Parfum,Not available,"[""Quantity: 100 ml"",""Ideal For: Men & Women"",""Fragrance Classification: Eau de Parfum"",""Fragrance Family: Woody"",""Fragrance Segment: Budget"",""Base Note: Amber, Musks, Moss Patchouli"",""Heart Note: Aniseed, Elemi Cardamom Clove Nutmeg Lavandin"",""Top Note: Ozonic green leaves citrus - Bergamot, lemon""]",Eau de Parfum,Men & Women,100 ml,Two Classic 50ml,Not available,Not available,Not available,Not available,Not available,Not available,Not available,Not available
https://rukminim1.flixcart.com/image/612/612/xif0q/perfume/e/b/r/-original-imagkyn5ygqurkky.jpeg?q=70,https://www.flipkart.com/park-avenue-founder-eau-de-parfum-100-ml/p/itmeba3d0ce2c256?pid=PERGH7SU3RZHZHZA&lid=LSTPERGH7SU3RZHZHZAHBWAEM&marketplace=FLIPKART&q=Perfumes&store=g9b%2F0yh%2Fjhz&srno=s_2_54&otracker=search&otracker1=search&fm=organic&iid=ebd06927-1bec-41b5-aa59-f7954869ccf3.PERGH7SU3RZHZHZA.SEARCH&ppt=None&ppn=None&ssid=5ybiuwyyf40000001680892679537&qH=912db86381b14a19,603,1200,PARK AVENUE Founder Eau de Parfum  -  100 ml  (For Men),4.1,26 ratings and 2 reviews,Beauty and Grooming,Fragrances,Perfume,Eau De Parfum,PARK AVENUE Eau De Parfum,Not available,"[""Quantity: 100 ml"",""Ideal For: Men"",""Fragrance Classification: Eau de Parfum"",""Fragrance Family: Floral"",""Fragrance Segment: Budget""]",Eau de Parfum,Men,100 ml,1 Perfume,Not available,Not available,Not available,Not available,Not available,Not available,Not available,Not available
https://rukminim1.flixcart.com/image/612/612/kkyc9zk0/perfume/g/o/8/men-perfume-30-ml-pack-of-4-eau-de-parfum-envy-men-original-imagy6h8hjgnmcdg.jpeg?q=70,https://www.flipkart.com/envy-men-perfume-30-ml-pack-4-eau-de-parfum-120-ml/p/itm494bf7112ab7b?pid=PERFUPV9GKHFFPYE&lid=LSTPERFUPV9GKHFFPYE8OKBXJ&marketplace=FLIPKART&q=Perfumes&store=g9b%2F0yh%2Fjhz&srno=s_2_55&otracker=search&otracker1=search&fm=organic&iid=ebd06927-1bec-41b5-aa59-f7954869ccf3.PERFUPV9GKHFFPYE.SEARCH&ppt=None&ppn=None&ssid=5ybiuwyyf40000001680892679537&qH=912db86381b14a19,430,700,ENVY Men Perfume 30 ml(Pack of 4) Eau de Parfum  -  120 ml  (For Men),4.4,"1,594 ratings and 97 reviews",Beauty and Grooming,Fragrances,Perfume,Eau De Parfum,ENVY Eau De Parfum,https://www.flipkart.com/envy-men-perfume-30-ml-pack-4-eau-de-parfum-120-ml/product-reviews/itm494bf7112ab7b?pid=PERFUPV9GKHFFPYE&lid=LSTPERFUPV9GKHFFPYE8OKBXJ&marketplace=FLIPKART,"[""Quantity: 120 ml"",""Ideal For: Men"",""Fragrance Classification: Eau de Parfum"",""Fragrance Family: Fresh"",""Fragrance Segment: Budget""]",Eau de Parfum,Men,120 ml,4,"1,063",265,132,53,81,97 Reviews,"[{""title"":""Wonderful"",""summary"":""Amazing Product 👏 Thank you Flipkart""},{""title"":""Terrific purchase"",""summary"":""Very good perfume""},{""title"":""Best in the market!"",""summary"":""nice""},{""title"":""Nice product"",""summary"":""Strong""},{""title"":""Waste of money!"",""summary"":""bad""},{""title"":""Classy product"",""summary"":""Superb smell and good product""},{""title"":""Terrific purchase"",""summary"":""Superb""},{""title"":""Terrific"",""summary"":""Lovely""},{""title"":""Terrific purchase"",""summary"":""Good""},{""title"":""Waste of money!"",""summary"":""Not good as expected""}]",India
https://rukminim1.flixcart.com/image/612/612/xif0q/perfume/g/v/6/50-sky-long-lasting-perfume-for-men-eau-de-toilette-the-man-original-imaghe46q3akaegs.jpeg?q=70,https://www.flipkart.com/man-company-sky-long-lasting-perfume-men-eau-de-parfum-50-ml/p/itm586dacab04686?pid=PERGHE46CTYA2QGZ&lid=LSTPERGHE46CTYA2QGZAOF2NG&marketplace=FLIPKART&q=Perfumes&store=g9b%2F0yh%2Fjhz&srno=s_2_56&otracker=search&otracker1=search&fm=organic&iid=en_EFclpuUgR6xuQ0YYjISdFpDuOI5OCW7K91ABotki8sc8gCqWxowoooMPZdVVyrptnkAGW97RusJg%2FCXIgyYaEA%3D%3D&ppt=None&ppn=None&ssid=5ybiuwyyf40000001680892679537&qH=912db86381b14a19,472,749,THE MAN COMPANY Sky | Long Lasting Perfume for men Eau de Parfum  -  50 ml  (For Men & Women),4.2,50 ratings and 24 reviews,Beauty and Grooming,Fragrances,Perfume,Eau De Parfum,THE MAN COMPANY Eau De Parfum,https://www.flipkart.com/man-company-sky-long-lasting-perfume-men-eau-de-parfum-50-ml/product-reviews/itm586dacab04686?pid=PERGHE46CTYA2QGZ&lid=LSTPERGHE46CTYA2QGZAOF2NG&marketplace=FLIPKART,"[""Quantity: 50 ml"",""Ideal For: Men & Women"",""Fragrance Classification: Eau de Parfum"",""Fragrance Family: Fruity"",""Fragrance Segment: Budget""]",Eau de Parfum,Men & Women,50 ml,50 ml Sky EDT,31,8,5,2,4,24 Reviews,"[{""title"":""Terrific purchase"",""summary"":""Awesome product , strong fragrance must buy""},{""title"":""Hated it!"",""summary"":""Very bad product.""},{""title"":""Highly recommended"",""summary"":""Premium perfume with very nice attractive smell""},{""title"":""Terrific"",""summary"":""Smell is just wow... I gift to my brother and he loved it...""},{""title"":""Super!"",""summary"":""Excellent product and long lastingHighly recommended""},{""title"":""Not good"",""summary"":""Not sooo good according to comments.. Very heard smell.. Smell is not as good as it's price and title🙂""},{""title"":""Not good"",""summary"":""Smell like 😞""},{""title"":""Useless product"",""summary"":""No long lasting..maximum 30 min. projection.fake 5 star  Reviews by company's employees.from Nasik and Mumbai""},{""title"":""Good choice"",""summary"":""FRAGRANCE OF THE PERFUME DOESN'T LAST LONG AS I EXPECTED.""},{""title"":""Very poor"",""summary"":""Not long lasting""}]",Not available
https://rukminim1.flixcart.com/image/612/612/xif0q/perfume/t/j/m/50-eau-de-parfum-bloom-50ml-eau-de-parfum-renee-women-original-imagha5d36sjjaww.jpeg?q=70,https://www.flipkart.com/renee-eau-de-parfum-bloom-50ml-50-ml/p/itme73cd103cbe35?pid=PERGGNX6XPHZUYH9&lid=LSTPERGGNX6XPHZUYH9FYGTOR&marketplace=FLIPKART&q=Perfumes&store=g9b%2F0yh%2Fjhz&srno=s_2_57&otracker=search&otracker1=search&fm=organic&iid=ebd06927-1bec-41b5-aa59-f7954869ccf3.PERGGNX6XPHZUYH9.SEARCH&ppt=None&ppn=None&ssid=5ybiuwyyf40000001680892679537&qH=912db86381b14a19,499,599,"Renee Eau De Parfum Bloom, 50ml Eau de Parfum  -  50 ml  (For Women)",4.2,"1,240 ratings and 79 reviews",Beauty and Grooming,Fragrances,Perfume,Eau De Parfum,Renee Eau De Parfum,https://www.flipkart.com/renee-eau-de-parfum-bloom-50ml-50-ml/product-reviews/itme73cd103cbe35?pid=PERGGNX6XPHZUYH9&lid=LSTPERGGNX6XPHZUYH9FYGTOR&marketplace=FLIPKART,"[""Quantity: 50 ml"",""Ideal For: Women"",""Fragrance Classification: Eau de Parfum"",""Fragrance Family: Floral"",""Fragrance Segment: Budget"",""Base Note: Base Notes - Musk, Amber, Cedarwood, Vanilla"",""Heart Note: Middle Notes - Rose, Waterlily, Jasmine"",""Top Note: Top Notes - Mandarin, Grapefruit, Pear, Pink Pepper, Cassis, Red Berries""]",Eau de Parfum,Women,50 ml,"1pc RENEE Eau De Parfum Dark Desire, 15ml",700,304,126,45,65,79 Reviews,"[{""title"":""Perfect product!"",""summary"":""The packing is superb and looks so lovely took it as a gift for my wife... She loved it and using it daily and the fragrance is Amazing...""},{""title"":""Must buy!"",""summary"":""Awesome aroma which is really not harsh to nose and has a very pleasant and mesmerizing smell, eau de parfum is highly concentrated and has a very long lasting fragrance, really good to use for dinner or night out parties""},{""title"":""Must buy!"",""summary"":""Best fragrance at this price range, bottle gives luxurious vibe scent is decent last for day long. It's strong yet not overpowering.""},{""title"":""Perfect product!"",""summary"":""Amazing Perfume. The bottle looks amazing and the smell is long lasting. The brand fulfills it's promise to deliver the best""},{""title"":""Really Nice"",""summary"":""Smells good.. stays for 4 hours max .. good packaging""},{""title"":""Mind-blowing purchase"",""summary"":""It's awesome I love it, don't wait on thinking just go for it""},{""title"":""Nice product"",""summary"":""It smells nice but didn't last long 2-3 hr max""},{""title"":""Just wow!"",""summary"":""Fabulous 😍""},{""title"":""Excellent"",""summary"":""Nice aroma""},{""title"":""Brilliant"",""summary"":""The smell is addictive..""}]",India
https://rukminim1.flixcart.com/image/612/612/l44hyfk0/shopsy-perfume/w/r/5/100-midnight-eau-de-parfum-ramsons-men-women-original-imagf3bpbxchhva4.jpeg?q=70,https://www.flipkart.com/ramsons-midnight-night-remember-eau-de-parfum-100-ml/p/itmadcc69c8bc08b?pid=PERGF3FUSHESPRYQ&lid=LSTPERGF3FUSHESPRYQQNBEG1&marketplace=FLIPKART&q=Perfumes&store=g9b%2F0yh%2Fjhz&srno=s_2_58&otracker=search&otracker1=search&fm=organic&iid=ebd06927-1bec-41b5-aa59-f7954869ccf3.PERGF3FUSHESPRYQ.SEARCH&ppt=None&ppn=None&ssid=5ybiuwyyf40000001680892679537&qH=912db86381b14a19,237,360,RAMSONS Midnight A night to remember Eau de Parfum  -  100 ml  (For Men & Women),4.3,417 ratings and 37 reviews,Beauty and Grooming,Fragrances,Perfume,Eau De Parfum,RAMSONS Eau De Parfum,https://www.flipkart.com/ramsons-midnight-night-remember-eau-de-parfum-100-ml/product-reviews/itmadcc69c8bc08b?pid=PERGF3FUSHESPRYQ&lid=LSTPERGF3FUSHESPRYQQNBEG1&marketplace=FLIPKART,"[""Quantity: 100 ml"",""Ideal For: Men & Women"",""Fragrance Classification: Eau de Parfum"",""Fragrance Family: Oriental"",""Fragrance Segment: Budget"",""Base Note: OAKMOSS, PATCHOULI, MUSK, AMBER"",""Heart Note: CUMIN, ANISEED, ROSE, JASMINE"",""Top Note: LAVENDER, MINT, GREEN, CAMPHOR, LEMONGRASS""]",Eau de Parfum,Men & Women,100 ml,Not available,254,84,37,22,20,37 Reviews,"[{""title"":""Good"",""summary"":""Good""},{""title"":""Classy product"",""summary"":""Nyc perfume and great smelling""},{""title"":""Moderate"",""summary"":""Not bad""},{""title"":""Terrific purchase"",""summary"":""Super""},{""title"":""Does the job"",""summary"":""Just ok""},{""title"":""Fair"",""summary"":""Good""},{""title"":""Best in the market!"",""summary"":""Good""},{""title"":""Good"",""summary"":""Value of money but don't buy this sombetter are Fogg and bellavita or denver""},{""title"":""Mind-blowing purchase"",""summary"":""Nice product""},{""title"":""Terrific purchase"",""summary"":""Ok""}]",India
