imagelink,productlink,price,maxretailprice,ProductName,stars,GlobalRatings,Category,Sub-category-1,Sub-category-2,Sub-category-3,Sub-category-4,reviewsLink,HighLights,Fragrance Classification,Ideal For,Quantity,Sales Package,5 star ratings,4 star ratings,3 star ratings,2 star ratings,1 star ratings,globalReviews,reviews,Country of Origin
https://rukminim1.flixcart.com/image/612/612/l3uhvgw0/perfume/u/o/o/140-men-perfume-women-perfume-combo-set-of-2-perfume-envy-men-original-imagevgafxkve9r3.jpeg?q=70,https://www.flipkart.com/envy-combo-perfume-men-women-70ml-eau-de-parfum-140-ml/p/itm97431ee99a359?pid=PEREWSNC5XEAMFRP&lid=LSTPEREWSNC5XEAMFRPKPD4X7&marketplace=FLIPKART&q=Perfumes&store=g9b%2F0yh%2Fjhz&srno=s_1_22&otracker=search&otracker1=search&fm=organic&iid=af2c2fe7-4a08-4f4f-ad79-8663de9e8359.PEREWSNC5XEAMFRP.SEARCH&ppt=None&ppn=None&ssid=16aitkw7rk0000001680892677586&qH=912db86381b14a19,388,550,ENVY Combo Perfume For Men and Women 70ML + 70ML Eau de Parfum  -  140 ml  (For Men & Women),4.4,"38,492 ratings and 3,764 reviews",Beauty and Grooming,Fragrances,Perfume,Eau De Parfum,ENVY Eau De Parfum,https://www.flipkart.com/envy-combo-perfume-men-women-70ml-eau-de-parfum-140-ml/product-reviews/itm97431ee99a359?pid=PEREWSNC5XEAMFRP&lid=LSTPEREWSNC5XEAMFRPKPD4X7&marketplace=FLIPKART,"[""Quantity: 140 ml"",""Ideal For: Men & Women"",""Fragrance Classification: Eau de Parfum"",""Fragrance Family: Fresh"",""Fragrance Segment: Budget""]",Eau de Parfum,Men & Women,140 ml,2 Perfumes,"24,147","8,591","3,227","1,093","1,434","3,764 Reviews","[{""title"":""Fair"",""summary"":""Black Envy is kind of strong fragrance but white on other side is for women & it is soapy kind of fragrance also it is light frag in nature.Longevity of Black Envy Perfume is 3-4 hrs. Max indoor.Longevity of white Envy Perfume is 2-3 hrs. Max indoor.As per my testing you can wear it on casual occasion or daily basis it's ok ok.3⭐ Rating.""},{""title"":""Fabulous!"",""summary"":""This is a very good product.👍 Fregnancy awesome 😍 smell is decent and cool charming 😌 Full Satisfied..""},{""title"":""Mind-blowing purchase"",""summary"":""Best smell in this budget range....Must purchaseI am leaving some photos, you can check them .🙂""},{""title"":""Mind-blowing purchase"",""summary"":""Every Time Fresh.... 😘 Don't Miss it""},{""title"":""Worth every penny"",""summary"":""smells great""},{""title"":""Simply awesome"",""summary"":""nice product""},{""title"":""Mind-blowing purchase"",""summary"":""nice perfume""},{""title"":""Awesome"",""summary"":""Very good fragance, my wife loved lot....Lasts for up to evening.""},{""title"":""Not recommended at all"",""summary"":""Totally waste of money..I baught single envy white for women but this pair is totally duplicate..Request to flipcart..slap all these local and worst product..And throw shoe on those who liked and promote this product""},{""title"":""Pretty good"",""summary"":""Nice smell""}]",India
https://rukminim1.flixcart.com/image/612/612/l2jcccw0/perfume/n/n/j/100-something-something-spray-eau-de-parfum-viwa-men-women-original-imagdukg8tteqneb.jpeg?q=70,https://www.flipkart.com/viwa-something-spray-eau-de-parfum-100-ml/p/itmf3wgzrzm5u9mc?pid=PERFFMHWPZE5JAXZ&lid=LSTPERFFMHWPZE5JAXZWCXI6H&marketplace=FLIPKART&q=Perfumes&store=g9b%2F0yh%2Fjhz&srno=s_1_23&otracker=search&otracker1=search&fm=organic&iid=af2c2fe7-4a08-4f4f-ad79-8663de9e8359.PERFFMHWPZE5JAXZ.SEARCH&ppt=None&ppn=None&ssid=16aitkw7rk0000001680892677586&qH=912db86381b14a19,203,297,VIWA Something Something Spray Eau de Parfum  -  100 ml  (For Men & Women),4.3,"3,472 ratings and 452 reviews",Beauty and Grooming,Fragrances,Perfume,Eau De Parfum,VIWA Eau De Parfum,https://www.flipkart.com/viwa-something-spray-eau-de-parfum-100-ml/product-reviews/itmf3wgzrzm5u9mc?pid=PERFFMHWPZE5JAXZ&lid=LSTPERFFMHWPZE5JAXZWCXI6H&marketplace=FLIPKART,"[""Quantity: 100 ml"",""Ideal For: Men & Women"",""Fragrance Classification: Eau de Parfum"",""Fragrance Family: Fresh"",""Fragrance Segment: Budget""]",Eau de Parfum,Men & Women,100 ml,1 Pack of 100 ml,"2,124",697,304,145,202,452 Reviews,"[{""title"":""Fabulous!"",""summary"":""Just awesome perfume..""},{""title"":""Terrific"",""summary"":""Awesome""},{""title"":""Value-for-money"",""summary"":""best""},{""title"":""Great product"",""summary"":""Good product nice fregrence and good delivery time very very thanks ....""},{""title"":""Highly recommended"",""summary"":""nice""},{""title"":""Brilliant"",""summary"":""Very nicefragnance""},{""title"":""Must buy!"",""summary"":""My wife suggest me this perfume. Really awesome fragrance. Must try. Don't confuse.""},{""title"":""Terrific"",""summary"":""I am in love with this fragrance.❤️😍...the smell is really ossom and also long lasting...🥰🥰🥰""},{""title"":""Excellent"",""summary"":""Nice spray""},{""title"":""Mind-blowing purchase"",""summary"":""Worth it!!""}]",india
https://rukminim1.flixcart.com/image/612/612/xif0q/perfume/d/1/v/50-social-eau-de-toilette-phy-men-women-original-imagghkyz8rsefus.jpeg?q=70,https://www.flipkart.com/phy-social-edt-ideal-chilled-out-party-fragrance-long-lasting-perfume-eau-de-toilette-50-ml/p/itmebc5e1f3ad63b?pid=PERGGHKYM58HM5C3&lid=LSTPERGGHKYM58HM5C3E4JDUM&marketplace=FLIPKART&q=Perfumes&store=g9b%2F0yh%2Fjhz&srno=s_1_24&otracker=search&otracker1=search&fm=organic&iid=en_j6rBww%2FKsntXnxUBiLGCeeA%2F6jLhcFxYf2JxZ%2B7vQZUUWIudLjh6dBMsOABBkiN9y51Y5tL%2BPJ0av9%2BqMD3nTQ%3D%3D&ppt=None&ppn=None&ssid=16aitkw7rk0000001680892677586&qH=912db86381b14a19,404,450,Phy Social EDT | Ideal chilled out party fragrance | Long lasting perfume Eau de Toilette  -  50 ml  (For Men & Women),4.1,855 ratings and 97 reviews,Beauty and Grooming,Fragrances,Perfume,Eau De Toilette,Phy Eau De Toilette,https://www.flipkart.com/phy-social-edt-ideal-chilled-out-party-fragrance-long-lasting-perfume-eau-de-toilette-50-ml/product-reviews/itmebc5e1f3ad63b?pid=PERGGHKYM58HM5C3&lid=LSTPERGGHKYM58HM5C3E4JDUM&marketplace=FLIPKART,"[""Quantity: 50 ml"",""Ideal For: Men & Women"",""Fragrance Classification: Eau de Toilette"",""Fragrance Family: Fruity"",""Fragrance Segment: Budget"",""Base Note: Brazilian Rosewood, Amber, Sandalwood"",""Heart Note: Lavender, Ginger, Tunisian Neroli"",""Top Note: Mint, Mandarin Orange, Juniper Berry""]",Eau de Toilette,Men & Women,50 ml,Not available,480,166,100,44,65,97 Reviews,"[{""title"":""Great product"",""summary"":""Nice fragrance at this price""},{""title"":""Decent product"",""summary"":""Good product, Fragrance is Just above average 👍🏻""},{""title"":""Mind-blowing purchase"",""summary"":""Good""},{""title"":""Excellent"",""summary"":""Smells really nice.. lasts for upto 3-4 hours..and has a soft smell after that time... So you can go for it.""},{""title"":""Hated it!"",""summary"":""Bad quality don't even stay one minute also...waste of money""},{""title"":""Terrific"",""summary"":""Amazing perfume 😌 go for it.... It smells so fresh and mesmerizing""},{""title"":""Could be way better"",""summary"":""Not long lasting 👎""},{""title"":""Expected a better product"",""summary"":""fragnrence is not good and not long lasting also""},{""title"":""Great product"",""summary"":""Product is very good. Fragrance is awesome i like the product.""},{""title"":""Highly recommended"",""summary"":""Nice""}]",Not available
https://rukminim1.flixcart.com/image/612/612/ky90scw0/perfume/w/u/4/30-ombre-eau-de-parfum-the-man-company-men-original-imagaj3fhzhyk5py.jpeg?q=70,https://www.flipkart.com/man-company-ombre-eau-de-parfum-30-ml/p/itmf5840115a41fd?pid=PERG36UJXQFEYHAX&lid=LSTPERG36UJXQFEYHAXYZYCWN&marketplace=FLIPKART&q=Perfumes&store=g9b%2F0yh%2Fjhz&srno=s_1_25&otracker=search&otracker1=search&fm=organic&iid=af2c2fe7-4a08-4f4f-ad79-8663de9e8359.PERG36UJXQFEYHAX.SEARCH&ppt=None&ppn=None&ssid=16aitkw7rk0000001680892677586&qH=912db86381b14a19,316,599,THE MAN COMPANY Ombre Eau de Parfum  -  30 ml  (For Men),4,"3,019 ratings and 359 reviews",Beauty and Grooming,Fragrances,Perfume,Eau De Parfum,THE MAN COMPANY Eau De Parfum,https://www.flipkart.com/man-company-ombre-eau-de-parfum-30-ml/product-reviews/itmf5840115a41fd?pid=PERG36UJXQFEYHAX&lid=LSTPERG36UJXQFEYHAXYZYCWN&marketplace=FLIPKART,"[""Quantity: 30 ml"",""Ideal For: Men"",""Fragrance Classification: Eau de Parfum"",""Fragrance Family: Fresh"",""Fragrance Segment: Budget"",""Base Note: Ambroxan, Amberwood, Vanilla"",""Heart Note: Grapefruit, Nutmeg, Amber"",""Top Note: Orange Blossom, Apple, spicy, Rose Absolute""]",Eau de Parfum,Men,30 ml,1 perfume (30ml),"1,593",583,370,174,299,359 Reviews,"[{""title"":""Excellent"",""summary"":""It is really a nice product and is very long lasting Great for gifting to someone, just in first use many  of my friends asked about this great fragrance.""},{""title"":""NICE FRAGRANCE"",""summary"":""PRODUCT WAS IN NICE PACKAGING... LASTS EASILY 6-7 HOURS .. THE TOP AND MID NOTES GRAPEFRUITS APPLE ARE VERY SWEET ENERGATIC REFREASHING AND LONG LAST,  NO SIKN IRRITATION FOUND AFTER USING IT GO FO IT, HIGHLY RECOMMENDED""},{""title"":""Terrific"",""summary"":""OMBRE perfume from THE MAN COMPANY is an excellent blend of Amberwood & Grapefruit. This sultry & fruity scent has become my go to choice for any occasion. The scent’s longevity is something that most people would love considering the price point. Best value for your money, just go for this scent.""},{""title"":""Excellent"",""summary"":""Man company has some good range of perfumes. I liked the vibrant fragrance for Ombre.  It's a good perfume to use on sunny days.""},{""title"":""Brilliant"",""summary"":""I just love men perfume and this one is so chique and elegant looking and plus the fragrance is long lasting. Though the bottle is small but just to spray and you are ready for the day.""},{""title"":""Awesome"",""summary"":""If you are somebody who like to smell fresh all day than this is the perfume you need. Its woody and long lasting fragrance makes you smell good the entire day. To be honest at first i was not sure about the product , but than i ordered it to give it a try and to my surprise it was totally amazing. Another best part about the product is that it is Made in India. Give it a try you will surely like it""},{""title"":""Super!"",""summary"":""It has a top note of grapefruit, a heart note of Apple, and a base note of Ambroxin. Top note is very clear and overpowering and settles down very nicely with a good silliage.""},{""title"":""Just WOW"",""summary"":""Amazing perfume, it's small size make it very comfortable and easy to carry so there is no tension that wee have to apply at home only.Also it's fragrance is so awesome that no one can say no to it.""},{""title"":""Must buy!"",""summary"":""Great combination of Grapefruit, Apple and Ambroxan , which makes it great buy.I bought this for gifting to my friend, and he really loved it.""},{""title"":""Terrific"",""summary"":""Such a quality perfume bought this for my son he love tha fragrance which is long lasting.give smooth nd good fragrance.just go for it must buy.""}]",India
https://rukminim1.flixcart.com/image/612/612/kkvhea80/perfume/a/w/h/60-polo-club-eau-de-parfum-league-eau-de-parfum-denver-men-original-imagy4g4zftqftz7.jpeg?q=70,https://www.flipkart.com/denver-league-eau-de-parfum-60-ml/p/itm96a0a931f693c?pid=PERGY4G5KD3RBBFM&lid=LSTPERGY4G5KD3RBBFMEJXV19&marketplace=FLIPKART&q=Perfumes&store=g9b%2F0yh%2Fjhz&srno=s_1_26&otracker=search&otracker1=search&fm=organic&iid=af2c2fe7-4a08-4f4f-ad79-8663de9e8359.PERGY4G5KD3RBBFM.SEARCH&ppt=None&ppn=None&ssid=16aitkw7rk0000001680892677586&qH=912db86381b14a19,212,348,DENVER League Eau de Parfum  -  60 ml  (For Men),4.2,"2,545 ratings and 196 reviews",Beauty and Grooming,Fragrances,Perfume,Eau De Parfum,DENVER Eau De Parfum,https://www.flipkart.com/denver-league-eau-de-parfum-60-ml/product-reviews/itm96a0a931f693c?pid=PERGY4G5KD3RBBFM&lid=LSTPERGY4G5KD3RBBFMEJXV19&marketplace=FLIPKART,"[""Quantity: 60 ml"",""Ideal For: Men"",""Fragrance Classification: Eau de Parfum"",""Fragrance Family: Woody"",""Fragrance Segment: Budget""]",Not available,Not available,Not available,Not available,"1,472",556,270,124,123,196 Reviews,"[{""title"":""Highly recommended"",""summary"":""Nice""},{""title"":""Wonderful"",""summary"":""Very pleasant""},{""title"":""Nice"",""summary"":""Just nice but long freshness""},{""title"":""Very Good"",""summary"":""It's awesome, because my seeing tht pack it self i ordered it😌❤️""},{""title"":""Best in the market!"",""summary"":""IT's  really good . i am happy with this .""},{""title"":""Brilliant"",""summary"":""Best product after Denver intense oud""},{""title"":""Excellent"",""summary"":""Ok""},{""title"":""Good choice"",""summary"":""Good smell 😍😍""},{""title"":""Mind-blowing purchase"",""summary"":""This product is very nice and beautiful fragrance.""},{""title"":""Highly recommended"",""summary"":""Similar to wild stone forest spice. Long lasting for indoors.Definitely VFM.""}]",Not available
https://rukminim1.flixcart.com/image/612/612/jxc5a4w0/perfume/g/6/h/50-romance-eau-de-parfum-secret-temptation-women-original-imafhtt7m5v6zmdm.jpeg?q=70,https://www.flipkart.com/secret-temptation-romance-eau-de-parfum-50-ml/p/itmf3wgvfr4qqcfz?pid=PERFGPKBYGG7XG6H&lid=LSTPERFGPKBYGG7XG6H7KRQUI&marketplace=FLIPKART&q=Perfumes&store=g9b%2F0yh%2Fjhz&srno=s_1_27&otracker=search&otracker1=search&fm=organic&iid=af2c2fe7-4a08-4f4f-ad79-8663de9e8359.PERFGPKBYGG7XG6H.SEARCH&ppt=None&ppn=None&ssid=16aitkw7rk0000001680892677586&qH=912db86381b14a19,250,399,secret temptation Romance Eau de Parfum  -  50 ml  (For Women),4.2,"24,159 ratings and 2,377 reviews",Beauty and Grooming,Fragrances,Perfume,Eau De Parfum,secret temptation Eau De Parfum,https://www.flipkart.com/secret-temptation-romance-eau-de-parfum-50-ml/product-reviews/itmf3wgvfr4qqcfz?pid=PERFGPKBYGG7XG6H&lid=LSTPERFGPKBYGG7XG6H7KRQUI&marketplace=FLIPKART,"[""Quantity: 50 ml"",""Ideal For: Women"",""Fragrance Classification: Eau de Parfum"",""Fragrance Family: Fruity"",""Fragrance Segment: Budget""]",Eau de Parfum,Women,50 ml,Not available,"13,533","5,331","2,726","1,080","1,489","2,377 Reviews","[{""title"":""Worth every penny"",""summary"":""thank You so much flipkart for this amazing product, this perfume is so good it smells nice and it's packaging was also good... the perfume bottle look so attractive😍and it smells so awesome thanks flipkart and also thanks for fast delivery and on time""},{""title"":""Deserves the title"",""summary"":""I bought this product few months back to gift my friend and myself also. But, it was delivered few days after my friend`s b`day. So, I kept both the  perfumes with me. Just to try this product, I ordered. But to my surprise, this perfume is really good. Its smell is really a temptation. I just love this product and recommend others to try atleast once. It is really worth it.""},{""title"":""Secret Temptation"",""summary"":""So I got this product recently as I got attracted to the low price but unfortunately I don't like the product. The packaging is quite good and safely packed. The perfume stays on for a long period and the changes slightly when you put it on your pulse points. This perfume is perfect for the people who like jasmine.""},{""title"":""Worthless"",""summary"":""Very strong smell of jasmine... i didn't expect this ... it cause me headache.. In my opinion,this perfume is good for people loves strong smell of jasmine. But it calms the strongness.. i didn't like..it even it calms... it makes me headache... sorry i expect more precious lovely smell... unfortunately didn't get 😓packaging is all good.. will not broke.. nd.. amount is ok.   Delivery is very good and fast one.. nice delivery..""},{""title"":""Excellent Perfume"",""summary"":""Highly recommended - great perfume in that low price. Flipkart is awesome. Simply one of the best i have ever tried... great for use throughout the day but preferred in the mornings... doesn't last beyond 10 hours though... very refreshing... smells very icy and minty.""},{""title"":""Just wow!"",""summary"":""Must buy this. Prize is very low for this parfum compared to other purfum...I really loved  the fragrance.. guys go for it🤩🤩Thanks lot to Flipkart, specially Delivering guys, you guys are so kind and genuine with the custome... keep it up🤗🤗""},{""title"":""Good perfume"",""summary"":""it is a good perfume....it also has a nice fragrance !!! i Bought it for my sister's birthday.. She liked it a lot !! You can go for it if you have a budget and don't want too much hard fragrance...!!!""},{""title"":""Simply awesome"",""summary"":""Very cute bottle.... I loved it.... 😘😘😘""},{""title"":""The product is really good"",""summary"":""The product is really good. This is one of the best fragrance from Temptation.""},{""title"":""Perfect product!"",""summary"":""it's really good.Smell is so Romantic.... long lasting perfume for woman's..must buy.....this one..""}]",India
https://rukminim1.flixcart.com/image/612/612/xif0q/perfume/e/q/c/50-me-floral-eau-de-parfum-live-in-the-moment-eau-de-parfum-original-imaghv96knszvsxm.jpeg?q=70,https://www.flipkart.com/mamaearth-me-floral-eau-de-parfum-live-moment-50-ml/p/itm26626999706b0?pid=PERGHV967SZHPPYQ&lid=LSTPERGHV967SZHPPYQMJNAYV&marketplace=FLIPKART&q=Perfumes&store=g9b%2F0yh%2Fjhz&srno=s_1_28&otracker=search&otracker1=search&fm=organic&iid=en_j6rBww%2FKsntXnxUBiLGCeeA%2F6jLhcFxYf2JxZ%2B7vQZWP2XJtFNIBsEJ23CDzAU2yS6L2zLWJE11Q1lFz5yM2HQ%3D%3D&ppt=None&ppn=None&ssid=16aitkw7rk0000001680892677586&qH=912db86381b14a19,349,699,mamaEarth ME Floral Eau De Parfum - Live in the Moment Eau de Parfum  -  50 ml  (For Men & Women),4.1,109 ratings and 7 reviews,Beauty and Grooming,Fragrances,Perfume,Eau De Parfum,mamaEarth Eau De Parfum,https://www.flipkart.com/mamaearth-me-floral-eau-de-parfum-live-moment-50-ml/product-reviews/itm26626999706b0?pid=PERGHV967SZHPPYQ&lid=LSTPERGHV967SZHPPYQMJNAYV&marketplace=FLIPKART,"[""Quantity: 50 ml"",""Ideal For: Men & Women"",""Fragrance Classification: Eau de Parfum"",""Fragrance Family: Woody"",""Fragrance Segment: Budget""]",Eau de Parfum,Men & Women,50 ml,Not available,61,20,17,3,8,7 Reviews,"[{""title"":""Worth every penny"",""summary"":""Best perfume fragrance is also so nice""},{""title"":""Worth every penny"",""summary"":""Best Parfum in the Market fully recommend to buy this product""},{""title"":""Terrific"",""summary"":""Good""},{""title"":""Must buy!"",""summary"":""Very very nice I happy""},{""title"":""Brilliant"",""summary"":""Nice fragrance""},{""title"":""Worth the money"",""summary"":""Fregance is nice. Not hard smell.""},{""title"":""Horrible"",""summary"":""Bad flavour""}]",Not available
https://rukminim1.flixcart.com/image/612/612/k0igia80/perfume/z/p/j/100-hamilton-caliber-perfume-100-ml-eau-de-parfum-denver-men-original-imafk9xecm6hgzrg.jpeg?q=70,https://www.flipkart.com/denver-hamilton-caliber-perfume-100-ml-eau-de-parfum/p/itm3721d45a35408?pid=PERFK9EHS9GGGZPJ&lid=LSTPERFK9EHS9GGGZPJIL2IF7&marketplace=FLIPKART&q=Perfumes&store=g9b%2F0yh%2Fjhz&srno=s_1_29&otracker=search&otracker1=search&fm=organic&iid=af2c2fe7-4a08-4f4f-ad79-8663de9e8359.PERFK9EHS9GGGZPJ.SEARCH&ppt=None&ppn=None&ssid=16aitkw7rk0000001680892677586&qH=912db86381b14a19,419,525,DENVER Hamilton Caliber Perfume 100 Ml Eau de Parfum  -  100 ml  (For Men),4.2,"2,852 ratings and 277 reviews",Beauty and Grooming,Fragrances,Perfume,Eau De Parfum,DENVER Eau De Parfum,https://www.flipkart.com/denver-hamilton-caliber-perfume-100-ml-eau-de-parfum/product-reviews/itm3721d45a35408?pid=PERFK9EHS9GGGZPJ&lid=LSTPERFK9EHS9GGGZPJIL2IF7&marketplace=FLIPKART,"[""Quantity: 100 ml"",""Ideal For: Men"",""Fragrance Classification: Eau de Parfum"",""Fragrance Family: Fruity"",""Fragrance Segment: Budget""]",Eau de Parfum,Men,100 ml,1 Denver Hamilton Caliber Perfume 100 Ml,"1,697",573,305,106,171,277 Reviews,"[{""title"":""Good choice"",""summary"":""PRESENTATION - 5/5VALUE FOR MONEY - 4/5SCENT/FRAGRANCE - citrus opening and then settles down with chocolatey and musky dry down alongwith hint of roasted almonds and honey.LONGEVITY - 5 to 6 hrs on skin PROJECTION - 2 hrs strongOCCASION - WINTERS / EVENING REMINDS YOU OF - VERSACE EROS FINAL RATINGS - 4 / 5""},{""title"":""Best in the market!"",""summary"":""It's an intense woody perfume, so it has a sweet smell. Good for dates and party.""},{""title"":""Good"",""summary"":""not lasting more than 2hrs""},{""title"":""Highly recommended"",""summary"":""Sweet and musky, vanilla smell.kinda Good morning deo smell but sweeter. Lasts for quite a long time. It's a night perfume. People say its 80-85% clone of Versace Eros.""},{""title"":""Just wow!"",""summary"":""Very nice .fregnice long lasting at least 8 hours in cold weather and 3 hours in summers .but value for money go for it""},{""title"":""Awesome"",""summary"":""Really nice perfume value for money, I recommend others to go for it""},{""title"":""Good quality product"",""summary"":""Good""},{""title"":""Awesome"",""summary"":""Fragrance is so nice and long lasting.must buy. worth purchase""},{""title"":""Great product"",""summary"":""👌🏻👌🏻👌🏻👌🏻it’s very very good and have nice smell""},{""title"":""Simply awesome"",""summary"":""Good smell""}]",India
https://rukminim1.flixcart.com/image/612/612/kikluvk0-0/perfume/w/b/3/100-magnet-apparel-perfume-eau-de-parfum-opp-men-women-original-imafybn5nvhswqe8.jpeg?q=70,https://www.flipkart.com/opp-magnet-apparel-perfume-eau-de-parfum-100-ml/p/itm6d7bcdb189054?pid=PERFYBN6SWRGGDDZ&lid=LSTPERFYBN6SWRGGDDZPFTFKV&marketplace=FLIPKART&q=Perfumes&store=g9b%2F0yh%2Fjhz&srno=s_1_30&otracker=search&otracker1=search&fm=organic&iid=af2c2fe7-4a08-4f4f-ad79-8663de9e8359.PERFYBN6SWRGGDDZ.SEARCH&ppt=None&ppn=None&ssid=16aitkw7rk0000001680892677586&qH=912db86381b14a19,244,305,OPP Magnet Apparel Perfume Eau de Parfum  -  100 ml  (For Men & Women),4.3,"4,008 ratings and 384 reviews",Beauty and Grooming,Fragrances,Perfume,Eau De Parfum,OPP Eau De Parfum,https://www.flipkart.com/opp-magnet-apparel-perfume-eau-de-parfum-100-ml/product-reviews/itm6d7bcdb189054?pid=PERFYBN6SWRGGDDZ&lid=LSTPERFYBN6SWRGGDDZPFTFKV&marketplace=FLIPKART,"[""Quantity: 100 ml"",""Ideal For: Men & Women"",""Fragrance Classification: Eau de Parfum"",""Fragrance Family: Floral"",""Fragrance Segment: Budget""]",Eau de Parfum,Men & Women,100 ml,1,"2,565",748,321,133,241,384 Reviews,"[{""title"":""Nice"",""summary"":""Super ,👌""},{""title"":""Terrific"",""summary"":""Evergreen perfume 🙂🙂""},{""title"":""Really Nice"",""summary"":""Summer special""},{""title"":""Classy product"",""summary"":""Using it for almost 20+ years... still an ultimate and always be..""},{""title"":""Worth every penny"",""summary"":""nice fragrance""},{""title"":""Brilliant"",""summary"":""Forever love. Using this perfume since 1996. And it's still awesome""},{""title"":""Worth every penny"",""summary"":""Nice perfume superb 🤩""},{""title"":""Fabulous!"",""summary"":""Wash cloth using comfort, and while wearing use this perfume,Trust me whole day you will be smelling excellent,everyone will be asking the perfume name, so please give a try, It will make everyone happy.""},{""title"":""Worst experience ever!"",""summary"":""I GOT BROKEN GLASS WITH NO PERFUME""},{""title"":""Waste of money!"",""summary"":""This product was very bad...""}]",India
