imagelink,productlink,price,maxretailprice,ProductName,stars,GlobalRatings,Category,Sub-category-1,Sub-category-2,Sub-category-3,Sub-category-4,reviewsLink,HighLights,Fragrance Classification,Ideal For,Quantity,Sales Package,5 star ratings,4 star ratings,3 star ratings,2 star ratings,1 star ratings,globalReviews,reviews,Country of Origin
https://rukminim1.flixcart.com/image/612/612/xif0q/perfume/v/f/p/50-fire-long-lasting-perfume-for-men-eau-de-parfum-the-man-original-imaghe3v9fsccysy.jpeg?q=70,https://www.flipkart.com/man-company-fire-long-lasting-perfume-men-eau-de-parfum-50-ml/p/itm0e2886961e087?pid=PERGHE3VZGFGUUFY&lid=LSTPERGHE3VZGFGUUFYCVFEWK&marketplace=FLIPKART&q=Perfumes&store=g9b%2F0yh%2Fjhz&srno=s_2_68&otracker=search&otracker1=search&fm=organic&iid=en_EFclpuUgR6xuQ0YYjISdFpDuOI5OCW7K91ABotki8sfnKww7gXMHctKKqLpYOTbjxWc0RZh8%2BryDKMpFNvcVCA%3D%3D&ppt=None&ppn=None&ssid=5ybiuwyyf40000001680892679537&qH=912db86381b14a19,359,749,THE MAN COMPANY Fire | Long Lasting Perfume for Men Eau de Parfum  -  50 ml  (For Men & Women),4.2,344 ratings and 83 reviews,Beauty and Grooming,Fragrances,Perfume,Eau De Parfum,THE MAN COMPANY Eau De Parfum,https://www.flipkart.com/man-company-fire-long-lasting-perfume-men-eau-de-parfum-50-ml/product-reviews/itm0e2886961e087?pid=PERGHE3VZGFGUUFY&lid=LSTPERGHE3VZGFGUUFYCVFEWK&marketplace=FLIPKART,"[""Quantity: 50 ml"",""Ideal For: Men & Women"",""Fragrance Classification: Eau de Parfum"",""Fragrance Family: Floral"",""Fragrance Segment: Budget""]",Eau de Parfum,Men & Women,50 ml,50 ml Fire EDP,224,47,32,15,26,83 Reviews,"[{""title"":""Just wow!"",""summary"":""The perfume fragrance is fantastic. Its way different than all other perfumes in terms of packaging, branding and asthetics as well. Look like super premium as compared to others in same price range. Absolutely love it.  Also most important thing is that it is long lasting than other perfumes.""},{""title"":""Fabulous!"",""summary"":""Smells great, priced reasonably - The spray feature is cool and so is the bottle.""},{""title"":""Excellent"",""summary"":""Good.. 👍👍""},{""title"":""Terrific"",""summary"":""The packaging of the product is superbFragrance is very refreshingMust buy product""},{""title"":""Worth every penny"",""summary"":""Had purchased this to gift a friend on his marriage..lovely fragrance..""},{""title"":""Perfect product!"",""summary"":""Very nice product""},{""title"":""Fabulous!"",""summary"":""If you are looking for a strong and long lasting perfume go for it""},{""title"":""Terrific purchase"",""summary"":""I like this perfume.it is long lasting""},{""title"":""Did not meet expectations"",""summary"":""Worst fragnance""},{""title"":""Worth every penny"",""summary"":""It's very good 😌""}]",Not available
https://rukminim1.flixcart.com/image/612/612/xif0q/perfume/s/d/p/100-oud-parfum-intense-perfume-for-men-women-with-long-lasting-original-imaghve5j37a3gzz.jpeg?q=70,https://www.flipkart.com/bella-vita-organic-oud-parfum-intense-perfume-men-women-long-lasting-fragrance-100-ml/p/itm2fbde271a2491?pid=PERGDSR5SER8KZGC&lid=LSTPERGDSR5SER8KZGCGS1P0V&marketplace=FLIPKART&q=Perfumes&store=g9b%2F0yh%2Fjhz&srno=s_2_69&otracker=search&otracker1=search&fm=organic&iid=ebd06927-1bec-41b5-aa59-f7954869ccf3.PERGDSR5SER8KZGC.SEARCH&ppt=None&ppn=None&ssid=5ybiuwyyf40000001680892679537&qH=912db86381b14a19,549,999,Bella vita organic OUD PARFUM Intense Perfume For Men & Women with Long Lasting Fragrance 100 ML Perfume  -  100 ml  (For Men & Women),4.3,"2,018 ratings and 462 reviews",Beauty and Grooming,Fragrances,Perfume,Bella vita organic Perfume,Not available,https://www.flipkart.com/bella-vita-organic-oud-parfum-intense-perfume-men-women-long-lasting-fragrance-100-ml/product-reviews/itm2fbde271a2491?pid=PERGDSR5SER8KZGC&lid=LSTPERGDSR5SER8KZGCGS1P0V&marketplace=FLIPKART,"[""Quantity: 100 ml"",""Ideal For: Men & Women"",""Fragrance Classification: Perfume"",""Fragrance Family: Floral"",""Fragrance Segment: Budget""]",Perfume,Men & Women,100 ml,Not available,"1,300",342,145,73,158,462 Reviews,"[{""title"":""Simply awesome"",""summary"":""This BELLA VITA OUD perfume has good nice fragrance which stays on you for good decent time.If you are familiar with OUD than you will definitely love this one... It has good longevity of 5-6 hrs with 1-2 hrs of projection... Overall 5 star!!""},{""title"":""Classy product"",""summary"":""One of the most classic fragrances, coming in one of the most classy packaging. Perfect for gifting, or for your own daily use. The fragrance is good, and lasts throughout the day. Would highly recommend trying it out.""},{""title"":""Terrific purchase"",""summary"":""This perfume has an amazing fragrance and it lasts very long . It's so good if u try it once you will use it more. Its fragrance is so strong and intense , i love it.""},{""title"":""Wonderful"",""summary"":""Awesome fragrance best for party and regular uses.It comes with classy packaging and long lasting fragrance. Highly recommended 👌""},{""title"":""Terrific"",""summary"":""This perfume is very smooth and long lasting than any other perfume  this is a better product compared with any other perfume and This Oud perfume is very nice and wellness and long time and price range very low than other perfume""},{""title"":""Super!"",""summary"":""BELLA VITA LUXURY OUD PARFUM One of the most classic fragrances comes with                   classy packaging and long-lasting fragrance.                   Just loved it""},{""title"":""Best in the market!"",""summary"":""This perfume has amazing and long lasting fragrance..The best part is that anyone can use it both male and female. The fragrance is too Rich and lasts long upto 12 hrs.. Must buy if you are perfume lover and it’s super affordable!""},{""title"":""Classy product"",""summary"":""Bella Vita Organic OUD PARFUMI am a huge fan of Oud perfumes and have been buying expensive items bcz of the fragrance. I was surprised to see OUD perfume in Bella Vita at such affordable price. Its so so good and long lasting. I am already in love with this""},{""title"":""Fabulous!"",""summary"":""BELLA VITA LUXURY OUD PARFUMThis perfume has amazing and long lasting fragrance and it comes with classy packaging. Must buy if you are perfume lover and it's super affordable.Just loved it.""},{""title"":""Super!"",""summary"":""The fragrance open up with a broast of citrus and spicy notes and change into a Woody, musky scent with some of sweetness. The longevity of the fragrance is excellent and last for hours without fading away.Overall this perfume gives rich and Luxurious feel.""}]",Not available
https://rukminim1.flixcart.com/image/612/612/xif0q/perfume/n/9/q/8-eau-de-parfum-bloom-8ml-eau-de-parfum-renee-women-original-imagjfuhhd3k25xh.jpeg?q=70,https://www.flipkart.com/renee-eau-de-parfum-bloom-8ml-8-ml/p/itme033eef320d59?pid=PERGGZFEACVSNVX8&lid=LSTPERGGZFEACVSNVX83ILKYO&marketplace=FLIPKART&q=Perfumes&store=g9b%2F0yh%2Fjhz&srno=s_2_70&otracker=search&otracker1=search&fm=organic&iid=ebd06927-1bec-41b5-aa59-f7954869ccf3.PERGGZFEACVSNVX8.SEARCH&ppt=None&ppn=None&ssid=5ybiuwyyf40000001680892679537&qH=912db86381b14a19,149,199,"Renee Eau De Parfum Bloom, 8ml Eau de Parfum  -  8 ml  (For Women)",4,"1,093 ratings and 94 reviews",Beauty and Grooming,Fragrances,Perfume,Eau De Parfum,Renee Eau De Parfum,https://www.flipkart.com/renee-eau-de-parfum-bloom-8ml-8-ml/product-reviews/itme033eef320d59?pid=PERGGZFEACVSNVX8&lid=LSTPERGGZFEACVSNVX83ILKYO&marketplace=FLIPKART,"[""Quantity: 8 ml"",""Ideal For: Women"",""Fragrance Classification: Eau de Parfum"",""Fragrance Family: Floral"",""Fragrance Segment: Budget"",""Base Note: Base Notes- Vanilla, Cocoa, Tonka"",""Heart Note: Middle Notes- Tuberose, Sandalwood, Jasmine"",""Top Note: Top - Almond""]",Eau de Parfum,Women,8 ml,"1pc RENEE Eau De Parfum Bloom, 8ml",540,232,159,66,96,94 Reviews,"[{""title"":""Must buy!"",""summary"":""Awesome it smells like Heaven🌼 really great perfume i would recommend this especially to teenage and young girls ❤ just love the fragrance it gives as sweet, smooth Fragrance of different roses""},{""title"":""Fabulous!"",""summary"":""It smells so good and is budget friendly as well. Must try as it is just 8ml so you can buy it as a sample.""},{""title"":""Good choice"",""summary"":""It smells heavenly!!""},{""title"":""Does the job"",""summary"":""Ok smell.""},{""title"":""Decent product"",""summary"":""Smells ok, very small bottle""},{""title"":""Mind-blowing purchase"",""summary"":""I like it and this perfume fragnance so good and long lasting go for it ❤❤""},{""title"":""Brilliant"",""summary"":""Love this smell amazing 😍""},{""title"":""Nice product"",""summary"":""The product smells exactly like 'Good Girl' by Carolina Harrera. Though, at first spray, it smells like a cheap perfume for a minute. But once it settles, the fragrance is good. The stay app. 5-6 hrs.""},{""title"":""Very poor"",""summary"":""Size is too small... And smells not good also ... Waste of money""},{""title"":""Super!"",""summary"":""Wow , it's a exact dupe of Caroline Herrera good girl perfume.... .""}]",India
https://rukminim1.flixcart.com/image/612/612/kz7bcsw0/perfume/u/h/r/24-all-time-classic-fragrance-for-women-set-of-3-8ml-each-refill-original-imagb9j8jwvdwwuv.jpeg?q=70,https://www.flipkart.com/perfumers-club-all-time-classic-fragrance-women-set-3-8ml-each-refill-lightr-eau-de-parfum-24-ml/p/itmf3dff25f4afa9?pid=PERGB9J8PJPCK3PH&lid=LSTPERGB9J8PJPCK3PHNL1TAA&marketplace=FLIPKART&q=Perfumes&store=g9b%2F0yh%2Fjhz&srno=s_2_71&otracker=search&otracker1=search&fm=organic&iid=ebd06927-1bec-41b5-aa59-f7954869ccf3.PERGB9J8PJPCK3PH.SEARCH&ppt=None&ppn=None&ssid=5ybiuwyyf40000001680892679537&qH=912db86381b14a19,184,599,PERFUMERS CLUB All Time Classic Fragrance For Women | Set of 3 - 8ml Each |Refill For Lightr| Eau de Parfum  -  24 ml  (For Women),4,344 ratings and 25 reviews,Beauty and Grooming,Fragrances,Perfume,Eau De Parfum,PERFUMERS CLUB Eau De Parfum,https://www.flipkart.com/perfumers-club-all-time-classic-fragrance-women-set-3-8ml-each-refill-lightr-eau-de-parfum-24-ml/product-reviews/itmf3dff25f4afa9?pid=PERGB9J8PJPCK3PH&lid=LSTPERGB9J8PJPCK3PHNL1TAA&marketplace=FLIPKART,"[""Quantity: 24 ml"",""Ideal For: Women"",""Fragrance Classification: Eau de Parfum"",""Fragrance Family: Woody"",""Fragrance Segment: Budget"",""Base Note: Amberwood,Patchouli,cedar wood,White Musk,Patchouli,Vanilla,Tonka Bean,Amber"",""Heart Note: Orange Blossom,Jasmine,Peony,Rose,Lily-of-the-Valley,Peach,Rose"",""Top Note: Raspberry,Gardenia,Neroli,Melon,Marine,Tuberose,Lily,Lotus,Freesia,Cyclamen,Orange,Ylang-Ylang,Jasmine,Mimosa,Orange Blossom""]",Eau de Parfum,Women,24 ml,"#Bombshell, #NightQueen, #Trendsetter which is of 8ml each inside every All Time Classic Fragrances for Women pack.",186,67,38,18,35,25 Reviews,"[{""title"":""Super!"",""summary"":""Gifted this to my friend ..and she loved it .""},{""title"":""Must buy!"",""summary"":""Love this product""},{""title"":""Perfect product!"",""summary"":""Bought as a gift for my sister on an occasion of Raksha Bandhan and she loved it. So go for it if you are not aware of someone's taste in fragrance, there is a chance that they might actually end up liking it.""},{""title"":""Simply awesome"",""summary"":""Just awsm""},{""title"":""Very Good"",""summary"":""Good""},{""title"":""Really Nice"",""summary"":""Nyc""},{""title"":""Does the job"",""summary"":""Decent. Doesn't stay long.""},{""title"":""Horrible"",""summary"":""Product is not oketmy to me""},{""title"":""Good"",""summary"":""I liked only one fragrance""},{""title"":""Best in the market!"",""summary"":""Nice""}]",INDIA
https://rukminim1.flixcart.com/image/612/612/kx0q4y80/perfume/r/x/y/100-arabic-oud-eau-de-parfum-a-a-aromas-men-women-original-imag9k8yxgtp6eys.jpeg?q=70,https://www.flipkart.com/aa-aromas-arabic-oud-eau-de-parfum-100-ml/p/itm1b5b8e51cfbe9?pid=PERG9K8YSD8GCVZZ&lid=LSTPERG9K8YSD8GCVZZVZR3I6&marketplace=FLIPKART&q=Perfumes&store=g9b%2F0yh%2Fjhz&srno=s_2_72&otracker=search&otracker1=search&fm=organic&iid=en_EFclpuUgR6xuQ0YYjISdFpDuOI5OCW7K91ABotki8scVhbbGue3oTfsy6IChPmr5q9jgz%2FgoKnzqI%2FpIc0HJww%3D%3D&ppt=None&ppn=None&ssid=5ybiuwyyf40000001680892679537&qH=912db86381b14a19,298,349,AA AROMAS Arabic Oud Eau de Parfum  -  100 ml  (For Men & Women),4,661 ratings and 71 reviews,Beauty and Grooming,Fragrances,Perfume,Eau De Parfum,AA AROMAS Eau De Parfum,https://www.flipkart.com/aa-aromas-arabic-oud-eau-de-parfum-100-ml/product-reviews/itm1b5b8e51cfbe9?pid=PERG9K8YSD8GCVZZ&lid=LSTPERG9K8YSD8GCVZZVZR3I6&marketplace=FLIPKART,"[""Quantity: 100 ml"",""Ideal For: Men & Women"",""Fragrance Classification: Eau de Parfum"",""Fragrance Family: Woody"",""Fragrance Segment: Budget"",""Base Note: AMBER, WOODY, MUSKY"",""Heart Note: HONEY, ROSE, FLORAL."",""Top Note: ALDEHYDIC, AROMATIC, CITRUS""]",Eau de Parfum,Men & Women,100 ml,1 perfume,355,117,80,49,60,71 Reviews,"[{""title"":""Very Good"",""summary"":""An ordinary Arabian fragrance, notes close to jannathul firdouz and its a man perfume, typically arabic mix of arabian Jasmine, grapes, wine, rose and some amber. Close to whisal dabab of ajmal. I like it. If u need an arabic smell, try this.. But smells so luxurious.. And actually from a laxury brand i think, when i smell this, i m like smelling the story of laila and majnu...""},{""title"":""Wonderful"",""summary"":""Great""},{""title"":""Worth the money"",""summary"":""It has smell of honey and jasmine 😁""},{""title"":""Perfect product!"",""summary"":""Very nice product. Smell good 👌👌👌👌""},{""title"":""Mind-blowing purchase"",""summary"":""Love it ❤""},{""title"":""Wonderful"",""summary"":""Smell are awesome I like it thanks to Flipkart...""},{""title"":""Fabulous!"",""summary"":""good smell""},{""title"":""Value-for-money"",""summary"":""Excellent quality product with best smell...But... written \""MRP\""  is 299 Rs on product and Flipkart shows 399 Rs...It's long lasting 4 to 4.30 hour...Need to improvement in long lasting smell with light version to fillup some additives and binders for kept it's fragrance aroma for long lasting....""},{""title"":""Value-for-money"",""summary"":""Really lasts long like 8 hrsSmells different but certainly noticed by others""},{""title"":""Mind-blowing purchase"",""summary"":""Nice satisfied and good product""}]",India
https://rukminim1.flixcart.com/image/612/612/l1tmf0w0/perfume/a/s/z/20-skai-aquatic-unisex-cologne-perfume-for-men-women-eau-de-original-imagdat4mkfbjkfh.jpeg?q=70,https://www.flipkart.com/bella-vita-organic-skai-aquatic-unisex-cologne-perfume-men-women-eau-de-20-ml/p/itmfd86c25b13701?pid=PERGDAT45FR3WQYK&lid=LSTPERGDAT45FR3WQYKFIU8MV&marketplace=FLIPKART&q=Perfumes&store=g9b%2F0yh%2Fjhz&srno=s_2_73&otracker=search&otracker1=search&fm=organic&iid=ebd06927-1bec-41b5-aa59-f7954869ccf3.PERGDAT45FR3WQYK.SEARCH&ppt=None&ppn=None&ssid=5ybiuwyyf40000001680892679537&qH=912db86381b14a19,244,349,Bella vita organic SKAI AQUATIC Unisex Cologne Perfume For Men & Women Eau de Cologne  -  20 ml  (For Men & Women),4.3,"1,712 ratings and 446 reviews",Beauty and Grooming,Fragrances,Perfume,Eau De Cologne,Bella vita organic Eau De Cologne,https://www.flipkart.com/bella-vita-organic-skai-aquatic-unisex-cologne-perfume-men-women-eau-de-20-ml/product-reviews/itmfd86c25b13701?pid=PERGDAT45FR3WQYK&lid=LSTPERGDAT45FR3WQYKFIU8MV&marketplace=FLIPKART,"[""Quantity: 20 ml"",""Ideal For: Men & Women"",""Fragrance Classification: Eau de Cologne"",""Fragrance Family: Fruity"",""Fragrance Segment: Budget""]",Eau de Cologne,Men & Women,20 ml,Not available,"1,066",334,158,71,83,446 Reviews,"[{""title"":""Perfect product!"",""summary"":""If you are searching for a long lasting perfume with amazing fragrance under one roof with an economic price i would suggest you to try this skai aquatic perfume it will give you amazing attraction in public with good confidence i have been using this perfume from one week and truly says this perfume will give you amazing experience as it gives to me so just go and buy it without thinking..💙""},{""title"":""Best in the market!"",""summary"":""This Perfume is so amazing so refreshing that i m just luving it...its fragrance & Aroma is so refreshing & longlasting... Its packaging is very very cute, handy & travel friendly. It is a Unisex perfume and can be used on any occasion like party, office , functions anywhere anytime.""},{""title"":""Fabulous!"",""summary"":""This purfume is really excellent. It has a very pleasant fragrance. It is really long lasting & very pretty look. I just love this ❤️❤️""},{""title"":""Excellent"",""summary"":""Bella Vita skai Aquatic unisex cologne perfume is the best with its amazing fragrance that gives you a pleasant feeling.Its also pocket friendly.The product is really nice .Carry it with you whenever and wherever you go.""},{""title"":""Great product"",""summary"":""This unisex perfume by bella vita luxury  is very pocket friendly and it's quality is awesome. It has Luxurious and premium bottle look. Easy to carry anywhere. Fragrance is divine and long lasting. Worth the purchase. Highly recommend !""},{""title"":""Great product"",""summary"":""Its a perfect pocket friendly perfume, long lasting fragrance.. Color & Bottle is too cute, perfect a gift hamper...affordable price range, I will surely buy it again...""},{""title"":""Just wow!"",""summary"":""This perfume from BellaVita contains iconic blend of bergamot and coriander at the top fuses perfectly with the invaluable ambergis at its base and pink pepper at its heart. The best part is that it comes in a classy packaging and stays for 7-8 hours The add on is that it is Unisex""},{""title"":""Perfect product!"",""summary"":""It has such beautiful packaging and beautiful scents with each of its unique fragrance.lt feels fresh after using it and it is long lasting.loved it ! I highly recommend this product""},{""title"":""Excellent"",""summary"":""Recently purchased and Absolutely loved the fragrance of Bella vita aquatic skai perfume. It’s long lasting. Packaging was perfectly done. I never had such amazing fragrance perfume that long lasts for 24- 48 hours in this price rate. It’s totally worth buying.""},{""title"":""Terrific purchase"",""summary"":""The fragrance is so good and the packaging is really nice n premium. Impressed by scent. I gifted it to my brother he really likes it ..you can use it daily.. very affordable. Scent persists for at least 6-8 hours and you will feel fresh fresh.""}]",India
https://rukminim1.flixcart.com/image/612/612/ku4ezrk0/perfume/e/d/7/cologne-spray-base-camp-perfume-ustraa-men-original-imag7bgrnpbn57dh.jpeg?q=70,https://www.flipkart.com/ustraa-cologne-spray-base-camp-perfume-100-ml/p/itmf3v9rzwyjgq7b?pid=DEOEVYTKXEXDU3QB&lid=LSTDEOEVYTKXEXDU3QBJP7ZEC&marketplace=FLIPKART&q=Perfumes&store=g9b%2F0yh%2Fjhz&srno=s_2_74&otracker=search&otracker1=search&fm=organic&iid=ebd06927-1bec-41b5-aa59-f7954869ccf3.DEOEVYTKXEXDU3QB.SEARCH&ppt=None&ppn=None&ssid=5ybiuwyyf40000001680892679537&qH=912db86381b14a19,566,899,USTRAA Cologne Spray Base Camp Perfume  -  100 ml  (For Men),4,"15,607 ratings and 2,261 reviews",Beauty and Grooming,Fragrances,Perfume,USTRAA Perfume,Not available,https://www.flipkart.com/ustraa-cologne-spray-base-camp-perfume-100-ml/product-reviews/itmf3v9rzwyjgq7b?pid=DEOEVYTKXEXDU3QB&lid=LSTDEOEVYTKXEXDU3QBJP7ZEC&marketplace=FLIPKART,"[""Quantity: 100 ml"",""Ideal For: Men"",""Fragrance Classification: Perfume"",""Fragrance Family: Fresh"",""Fragrance Segment: Budget""]",Perfume,Men,100 ml,Cologne Spray - Base Camp,"7,946","3,290","1,940",960,"1,471","2,261 Reviews","[{""title"":""Highly recommended"",""summary"":""I was looking for a perfect colonge which I can use daily. Then, I came across this beautiful and very attractive blue bottle from Ustraa. I read the description and it said that this  colonge has top notes of bergamot lemon and lime and bottom notes of Cedar, Amber and Rich Musk. I thought to give it a try and instantly purchased it. Also, the price is very reasonable.I really LOVED this colonge. It smells so fresh and musky that  many of my colleagues at office have asked me what fragrance...""},{""title"":""Excellent"",""summary"":""Nice cologne. Nice fragrance.This is strong enough and seems to longer for more than 10 hours. Purchased it for myself. I really impressed and its worth for the price.""},{""title"":""Perfect product!"",""summary"":""Received a nice cologne bottle. The blue color is so refreshing. It looks beautiful. Ordered this for my brother and he loved it. The fragrance is amazing and it stays for really long time. This one is added to my brother's favourites list. It's a totally luxury cologne. Worth the price I paid.""},{""title"":""Worth every penny"",""summary"":""It just smells good and good choice.Gives musky and long lasting fragrance and its perfect for all time use. Received same quantity as mentioned and it's worth for the money.""},{""title"":""Wonderful"",""summary"":""Really nice fragrance best for casual use. Gives fresh feel for upto 7 ,10 hours. Its in liquid form and worth for price. If u are looking for mild decent fragrance then this is for u go for it.""},{""title"":""Classy product"",""summary"":""The fragrance which I can't get anywhere else. I am a college student and I apply it in the morning and lasts whole day. The fragrance is so amazing. My friends asked the name and ordered at the same moment they loved the fragrance. The fragrance is so amazing it feels very fresh whole day. I recommend this product to everyone and this product is totally worth in this price range. Thankyou ustraa for a amazing product.""},{""title"":""Excellent"",""summary"":""Review is based on my 5-6 days uses. Perfume fragrance is smooth and refreshing, it's last for 4-5 hours. Good for day to day office/general use, but it's totally depends on specific need and uses. Pakaging is good, color grading of bottle is good, it will look more nice if they use some attractive shape bottle.""},{""title"":""Highly recommended"",""summary"":""Ordered this for my brother and he liked everything about it, starting from the perfume bottle to the fragrance, everything is good about this perfume. The fragrance lasts for whole day. It's suitable for all occasions and can be used daily.""},{""title"":""Mind-blowing purchase"",""summary"":""If you like fresh and subtle smells, you need to try this ustraa perfume. The base of this perfume is so unique. It is perfect for night outs and special occasions when you're feeling kind of fancy. In short I can say it was amazing to have this and use this. Lovely.""},{""title"":""Worth every penny"",""summary"":""very soothing fragrance. I heard about them from many people and bought it a few days back. long lasting fragrance. the glass bottle is very attractive and grip is good. this is my favorite fragrance from all 3 variants available""}]",Not available
https://rukminim1.flixcart.com/image/612/612/k6l2vm80/perfume/v/q/u/30-efferus-edt-eau-de-toilette-the-man-company-men-original-imafzztdrygffyyd.jpeg?q=70,https://www.flipkart.com/man-company-efferus-edt-eau-de-toilette-30-ml/p/itm5ff56cc2e5d3e?pid=PERFZYB6X4BXVVQU&lid=LSTPERFZYB6X4BXVVQUYGIBJF&marketplace=FLIPKART&q=Perfumes&store=g9b%2F0yh%2Fjhz&srno=s_2_75&otracker=search&otracker1=search&fm=organic&iid=ebd06927-1bec-41b5-aa59-f7954869ccf3.PERFZYB6X4BXVVQU.SEARCH&ppt=None&ppn=None&ssid=5ybiuwyyf40000001680892679537&qH=912db86381b14a19,209,599,THE MAN COMPANY Efferus EDT Eau de Toilette  -  30 ml  (For Men),4.1,"1,479 ratings and 123 reviews",Beauty and Grooming,Fragrances,Perfume,Eau De Toilette,THE MAN COMPANY Eau De Toilette,https://www.flipkart.com/man-company-efferus-edt-eau-de-toilette-30-ml/product-reviews/itm5ff56cc2e5d3e?pid=PERFZYB6X4BXVVQU&lid=LSTPERFZYB6X4BXVVQUYGIBJF&marketplace=FLIPKART,"[""Quantity: 30 ml"",""Ideal For: Men"",""Fragrance Classification: Eau de Toilette"",""Fragrance Family: Woody"",""Fragrance Segment: Budget"",""Base Note: Amberwood, Oudh and Patchouli"",""Heart Note: Sandalwood, Coriander and Cardamom"",""Top Note: Bergamot ,Lemon and Mint""]",Eau de Toilette,Men,30 ml,Efferus EDT,819,262,190,82,126,123 Reviews,"[{""title"":""Terrific purchase"",""summary"":""Excellent,the fragrance of this perfume is nice and long lasting""},{""title"":""Fair"",""summary"":""Not satisfied with perfume smell... I thought it would be more attractive but it's fail to do.. also it's not longer than half n hour""},{""title"":""Brilliant"",""summary"":""I am loving this fragrance , also it is long lasting.""},{""title"":""Good choice"",""summary"":""Veri nice product 👌""},{""title"":""Very poor"",""summary"":""Not good........ Don't believe on this review.....""},{""title"":""Terrible product"",""summary"":""5 minute  lasting only very bad""},{""title"":""Brilliant"",""summary"":""😮😮😮Just awesome 😍""},{""title"":""Not recommended at all"",""summary"":""Worst""},{""title"":""Waste of money!"",""summary"":""Not at all last for an hour,the fragrance is also like women perfumes... Absolutely Waste of money""},{""title"":""Terrific"",""summary"":""Nice fregrence smell's good nice product""}]",India
